{
  "$schema": "https://json-schema.org/draft/2020-12/schema",
  "$id": "https://humanrepairmap.com/schema/capability.schema.json",
  "title": "Capability",
  "description": "Something humanity must be able to DO to a target for repair to happen, graded on how far it has actually been demonstrated and what blocks the next rung. One file per capability under records/capabilities-graph/. The 155 grid capabilities (cell type × class) are DERIVED by the build from records/cells and are not stored as files.",
  "type": "object",
  "required": [
    "id",
    "type",
    "name",
    "class",
    "description",
    "projections",
    "grade",
    "provenance",
    "review"
  ],
  "additionalProperties": false,
  "properties": {
    "id": {
      "$ref": "common.schema.json#/$defs/id"
    },
    "type": {
      "const": "capability"
    },
    "name": {
      "type": "string",
      "minLength": 3,
      "maxLength": 160
    },
    "class": {
      "$ref": "common.schema.json#/$defs/capabilityClass"
    },
    "primitive": {
      "$ref": "common.schema.json#/$defs/primitive"
    },
    "description": {
      "type": "string",
      "minLength": 20,
      "description": "What 'having this capability' concretely means — phrased so that a demonstration either meets it or does not."
    },
    "target": {
      "type": "object",
      "properties": {
        "node": {
          "$ref": "common.schema.json#/$defs/id",
          "description": "The grid node (hrm:cell/...) this acts on, if specific."
        },
        "tissue": {
          "type": "string",
          "description": "UBERON id or label"
        },
        "cellType": {
          "type": "string",
          "description": "CL id or label"
        },
        "species": {
          "type": "string",
          "description": "NCBITaxon id of the target organism the grade refers to. Default human (9606)."
        }
      }
    },
    "projections": {
      "type": "array",
      "items": {
        "$ref": "common.schema.json#/$defs/projection"
      },
      "minItems": 1,
      "uniqueItems": true
    },
    "grade": {
      "type": "object",
      "required": [
        "basis",
        "note"
      ],
      "additionalProperties": false,
      "properties": {
        "basis": {
          "type": "string",
          "enum": [
            "claims",
            "standard-of-care",
            "no-evidence-located",
            "ungraded"
          ],
          "description": "claims: the grade is traceable to at least one claim that supports or contradicts this capability (the build enforces it). standard-of-care: routine clinical practice; the note must say what practice. no-evidence-located: a search was made and nothing was found; rung is L0. ungraded: the node exists so the gap is visible, but nobody has graded it yet; rung is absent."
        },
        "rung": {
          "$ref": "common.schema.json#/$defs/rung"
        },
        "measured": {
          "$ref": "common.schema.json#/$defs/measured"
        },
        "blocked": {
          "$ref": "common.schema.json#/$defs/blocked"
        },
        "note": {
          "type": "string",
          "minLength": 20,
          "description": "Why it sits at this rung — a grade without a reason cannot be checked."
        },
        "drift": {
          "type": "string",
          "description": "The distance between what was demonstrated and what is commonly claimed."
        },
        "searchedOn": {
          "$ref": "common.schema.json#/$defs/date",
          "description": "For no-evidence-located: when the search was made."
        }
      },
      "allOf": [
        {
          "if": {
            "properties": {
              "basis": {
                "enum": [
                  "claims",
                  "standard-of-care"
                ]
              }
            }
          },
          "then": {
            "required": [
              "rung",
              "measured",
              "blocked"
            ]
          }
        },
        {
          "if": {
            "properties": {
              "basis": {
                "const": "no-evidence-located"
              }
            }
          },
          "then": {
            "required": [
              "rung",
              "searchedOn"
            ],
            "properties": {
              "rung": {
                "const": "L0"
              }
            }
          }
        },
        {
          "if": {
            "properties": {
              "basis": {
                "const": "ungraded"
              }
            }
          },
          "then": {
            "not": {
              "required": [
                "rung"
              ]
            }
          }
        }
      ]
    },
    "requires": {
      "type": "array",
      "items": {
        "$ref": "common.schema.json#/$defs/requirementGroup"
      }
    },
    "blockedBy": {
      "$ref": "common.schema.json#/$defs/idList",
      "description": "Question ids that gate the next rung."
    },
    "informationLimited": {
      "type": "boolean",
      "description": "True when the target state cannot be inferred from surviving information (see ontology/repair-primitives.json boundary)."
    },
    "wouldMove": {
      "type": "string",
      "description": "The specific missing demonstration that would raise the rung."
    },
    "aliases": {
      "type": "array",
      "items": {
        "type": "string"
      }
    },
    "provenance": {
      "$ref": "common.schema.json#/$defs/provenance"
    },
    "review": {
      "$ref": "common.schema.json#/$defs/review"
    },
    "derived": {
      "type": "boolean",
      "description": "True for the grid capabilities the build derives from records/cells (one per node x class). Never stored as a file."
    }
  }
}
