{
  "type": "capability",
  "id": "hrm:capability/fibrogenic-fibroblast-lineage-control",
  "name": "Control the fibroblast lineage that produces scar",
  "class": "edit",
  "primitive": "recalibrate",
  "projections": [
    "universal-repair",
    "rejuvenation"
  ],
  "description": "Identify the fibroblast population responsible for fibrotic deposition and prevent its activation or convert it, so that the regenerative population heals the wound.",
  "target": {
    "node": "hrm:cell/fibroblast"
  },
  "grade": {
    "basis": "claims",
    "rung": "L2",
    "measured": "structure",
    "blocked": "science",
    "note": "Distinct dermal fibroblast lineages determine dermal architecture (Driskell 2013); the Engrailed-1 lineage carries intrinsic fibrogenic potential and produces the bulk of scar (Rinkevich 2015); tension drives Engrailed-1 activation and blocking it yields regeneration (Mascharak 2021). Three papers, two overlapping groups, all mouse. Human fibroblast heterogeneity is described but not controlled."
  },
  "blockedBy": [
    "hrm:question/en1-inhibition-translates-to-human-skin",
    "hrm:question/what-limits-regeneration-in-mus-and-human"
  ],
  "provenance": {
    "proposedBy": {
      "type": "ai",
      "name": "Claude Code session e7dc5601 (Anthropic)",
      "model": "claude-opus-5",
      "session": "e7dc5601-1690-47c6-bf13-9ca150d31960"
    },
    "method": "manual reasoning from the cited sources' abstracts (PubMed) and Crossref metadata, checked 2026-09-11; no source opened at figure level",
    "date": "2026-09-11",
    "evidenceAccessed": [
      "hrm:source/driskell-2013-nature",
      "hrm:source/rinkevich-2015-science",
      "hrm:source/mascharak-2021-science"
    ]
  },
  "review": {
    "state": "ai-proposed",
    "date": "2026-09-11"
  }
}
