{
  "type": "capability",
  "id": "hrm:capability/cardiomyocyte-proliferation-induction",
  "name": "Make the surviving heart muscle divide",
  "class": "control",
  "primitive": "regenerate",
  "projections": [
    "universal-repair",
    "rejuvenation"
  ],
  "description": "Induce existing adult cardiomyocytes to re-enter the cell cycle and divide, so that the heart repairs itself rather than receiving cells from outside.",
  "target": {
    "node": "hrm:cell/cardiomyocyte"
  },
  "grade": {
    "basis": "claims",
    "rung": "L3",
    "measured": "structure",
    "blocked": "science",
    "note": "A four-factor cell cycle combination drove adult cardiomyocyte division and improved function after infarction in mice (Mohamed 2018). In pigs, AAV-delivered miR-199a produced striking functional repair — and then uncontrolled proliferation and sudden death in most treated animals (Gabisonia 2019). The rung is L3 because the large-animal study is real; the note is the point of the record.",
    "drift": "'The heart can be made to regenerate itself' — it can, and in the one large-animal test the animals died of it. Control, not induction, is the unsolved part."
  },
  "wouldMove": "A large-animal study with dose-controlled, self-limiting proliferation and no arrhythmic or proliferative deaths.",
  "provenance": {
    "proposedBy": {
      "type": "ai",
      "name": "Claude Code session b1762020 (Anthropic)",
      "model": "claude-opus-5",
      "session": "b1762020-2a53-4f0e-8cbd-18239bda19a3"
    },
    "method": "manual reasoning from the cited sources' abstracts (Crossref/Europe PMC), checked 2026-09-14; no source opened at figure level",
    "date": "2026-09-14",
    "evidenceAccessed": [
      "hrm:source/mohamed-2018-cell",
      "hrm:source/gabisonia-2019-nature",
      "hrm:source/eschenhagen-2017-circulation"
    ]
  },
  "review": {
    "state": "ai-proposed",
    "date": "2026-09-14"
  }
}
