{
  "type": "capability",
  "id": "hrm:capability/established-dermal-scar-reversal",
  "name": "Remodel an established scar into native dermis",
  "class": "edit",
  "primitive": "remove",
  "projections": [
    "universal-repair",
    "rejuvenation"
  ],
  "description": "Convert a mature fibrotic dermal scar back into dermis with native matrix organisation and appendages — reversal, not prevention.",
  "target": {
    "node": "hrm:cell/extracellular-matrix"
  },
  "grade": {
    "basis": "claims",
    "rung": "L0",
    "measured": "none",
    "blocked": "science",
    "note": "No therapy reverses established fibrosis in any organ; approved antifibrotics slow progression (Henderson 2020, review). For dermal scar specifically, no reversal demonstration was located. The rung is L0 on the strength of a contradicting review, not an absence of search."
  },
  "blockedBy": [
    "hrm:question/established-scar-remodelling-to-native-architecture"
  ],
  "provenance": {
    "proposedBy": {
      "type": "ai",
      "name": "Claude Code session e7dc5601 (Anthropic)",
      "model": "claude-opus-5",
      "session": "e7dc5601-1690-47c6-bf13-9ca150d31960"
    },
    "method": "manual reasoning from the cited sources' abstracts (PubMed) and Crossref metadata, checked 2026-09-11; no source opened at figure level",
    "date": "2026-09-11",
    "evidenceAccessed": [
      "hrm:source/henderson-2020-nature"
    ]
  },
  "review": {
    "state": "ai-proposed",
    "date": "2026-09-11"
  }
}
