{
  "type": "capability",
  "id": "hrm:capability/systemic-cell-type-specific-delivery",
  "name": "Deliver a payload to a chosen cell type throughout the body",
  "class": "reach",
  "projections": [
    "universal-repair",
    "rejuvenation"
  ],
  "description": "Address a payload to one cell type across all its tissues from a systemic dose, at useful efficiency, repeatably, without off-target harm — the 'universal addressability' the black box needs.",
  "grade": {
    "basis": "claims",
    "rung": "L4",
    "measured": "transduction",
    "blocked": "science",
    "note": "The best systemic case on this map is intravenous AAV9 in spinal muscular atrophy: clinical benefit is real and replicated, but direct evidence of human CNS transduction rests on two autopsies with liver vector hundreds-fold higher than CNS (Thomsen 2021). Liver and blood are tractable; arbitrary cell-type-specific delivery is not. The 16 graded CNS routes in this map are the detailed picture for one organ.",
    "drift": "'Systemic gene therapy reaches the brain' rests on n=2 post-mortem samples."
  },
  "blockedBy": [
    "hrm:question/rejuvenation-reach-beyond-eye-and-liver"
  ],
  "provenance": {
    "proposedBy": {
      "type": "ai",
      "name": "Claude Code session e7dc5601 (Anthropic)",
      "model": "claude-opus-5",
      "session": "e7dc5601-1690-47c6-bf13-9ca150d31960"
    },
    "method": "manual reasoning from the cited sources' abstracts (PubMed) and Crossref metadata, checked 2026-09-11; no source opened at figure level",
    "date": "2026-09-11",
    "evidenceAccessed": [
      "hrm:source/thomsen-2021-natmed"
    ]
  },
  "review": {
    "state": "ai-proposed",
    "date": "2026-09-11"
  }
}
