{
  "type": "capability",
  "id": "hrm:capability/nerve-transfer-from-a-donor-nerve",
  "name": "Rewire a nerve from a nearby healthy donor",
  "class": "control",
  "primitive": "reconnect",
  "projections": [
    "universal-repair"
  ],
  "description": "Cut an expendable working nerve fascicle near the target muscle and suture it to the paralysed nerve, so that regrowth starts close to the muscle instead of at the original injury.",
  "target": {
    "node": "hrm:cell/peripheral-neuron"
  },
  "grade": {
    "basis": "claims",
    "rung": "L5",
    "measured": "function",
    "blocked": "science",
    "note": "The Oberlin transfer (ulnar fascicle to biceps branch) restored elbow flexion in patients with C5-C6 avulsion where no repair at the plexus was possible (Oberlin 1994), and nerve transfers are now standard for proximal injuries. It works because it shortens the distance, which is a workaround for the clock rather than a fix for it. Donor nerves for intrinsic hand muscles do not exist in the same way."
  },
  "wouldMove": "A transfer strategy that restores intrinsic hand function after a proximal injury, which no donor currently provides.",
  "provenance": {
    "proposedBy": {
      "type": "ai",
      "name": "Claude Code session b1762020 (Anthropic)",
      "model": "claude-opus-5",
      "session": "b1762020-2a53-4f0e-8cbd-18239bda19a3"
    },
    "method": "manual reasoning from the cited sources' abstracts (Crossref/Europe PMC), checked 2026-09-14; no source opened at figure level",
    "date": "2026-09-14",
    "evidenceAccessed": [
      "hrm:source/oberlin-1994-jhs"
    ]
  },
  "review": {
    "state": "ai-proposed",
    "date": "2026-09-14"
  }
}
