{
  "type": "capability",
  "id": "hrm:capability/autonomic-function-restoration-after-sci",
  "name": "Restore bladder, bowel and blood-pressure control",
  "class": "control",
  "primitive": "recalibrate",
  "projections": [
    "universal-repair"
  ],
  "description": "Return autonomic function after a cord injury: continence, bowel control, stable blood pressure without autonomic dysreflexia, and sexual function.",
  "target": {
    "node": "hrm:cell/neural-connectivity"
  },
  "grade": {
    "basis": "no-evidence-located",
    "rung": "L0",
    "searchedOn": "2026-09-14",
    "note": "Placed so the gap is visible. Autonomic recovery is consistently what people with spinal cord injury rank above walking, and this seed located no evidence base for restoring it; the stimulation literature cited here reports autonomic effects as secondary observations. Grading it is the first open task on this node."
  },
  "wouldMove": "Any controlled human study with a primary autonomic endpoint — continence, cardiovascular stability — after a cord repair or stimulation intervention.",
  "provenance": {
    "proposedBy": {
      "type": "ai",
      "name": "Claude Code session b1762020 (Anthropic)",
      "model": "claude-opus-5",
      "session": "b1762020-2a53-4f0e-8cbd-18239bda19a3"
    },
    "method": "manual reasoning from the cited sources' abstracts (Crossref/Europe PMC), checked 2026-09-14; no source opened at figure level",
    "date": "2026-09-14"
  },
  "review": {
    "state": "ai-proposed",
    "date": "2026-09-14"
  }
}
