{
  "type": "capability",
  "id": "hrm:capability/cns-drug-delivery-past-the-barrier",
  "name": "Get the therapy past the blood-brain barrier",
  "class": "reach",
  "primitive": "preserve",
  "projections": [
    "universal-repair"
  ],
  "description": "Deliver a therapeutic agent or cell to tumour throughout the brain, including where the barrier is intact around infiltrating cells.",
  "target": {
    "node": "hrm:cell/cns-neuron"
  },
  "grade": {
    "basis": "claims",
    "rung": "L4",
    "measured": "access",
    "blocked": "science",
    "note": "Pulsed ultrasound with microbubbles opened the barrier repeatedly and safely in patients (Carpentier 2016) — access demonstrated in humans. Intraventricular and intrathecal routes bypass the barrier and reach tumour, as the CAR T studies show. What is not solved is reaching infiltrating cells behind an intact barrier across the whole brain, and Sarkaria's review argues the barrier is far less disrupted in glioblastoma than the enhancing-tumour picture suggests. See also the map's CNS delivery module for the 16 routes.",
    "drift": "'The blood-brain barrier is broken in glioblastoma, so drugs get in' — it is disrupted where the tumour enhances on imaging and intact around the cells that cause recurrence."
  },
  "wouldMove": "Measured drug concentration at the infiltrating margin, in patients, at a level shown to be cytotoxic.",
  "provenance": {
    "proposedBy": {
      "type": "ai",
      "name": "Claude Code session b1762020 (Anthropic)",
      "model": "claude-opus-5",
      "session": "b1762020-2a53-4f0e-8cbd-18239bda19a3"
    },
    "method": "manual reasoning from the cited sources' abstracts (Crossref/Europe PMC), checked 2026-09-14; no source opened at figure level",
    "date": "2026-09-14",
    "evidenceAccessed": [
      "hrm:source/carpentier-2016-scitranslmed",
      "hrm:source/sarkaria-2018-neurooncol"
    ]
  },
  "review": {
    "state": "ai-proposed",
    "date": "2026-09-14"
  }
}
