{
  "type": "capability",
  "id": "hrm:capability/acute-wound-infection-control",
  "name": "Prevent and treat acute wound infection",
  "class": "control",
  "primitive": "remove",
  "projections": [
    "universal-repair"
  ],
  "description": "Debride contaminated tissue and eliminate planktonic pathogens from an acute wound so healing can proceed.",
  "target": {
    "node": "hrm:cell/microbiome"
  },
  "grade": {
    "basis": "standard-of-care",
    "rung": "L5",
    "measured": "function",
    "blocked": "none",
    "note": "Surgical debridement, irrigation and systemic or topical antimicrobials are routine and effective for acute wounds. Antimicrobial resistance erodes this capability over time and is not graded here."
  },
  "provenance": {
    "proposedBy": {
      "type": "ai",
      "name": "Claude Code session e7dc5601 (Anthropic)",
      "model": "claude-opus-5",
      "session": "e7dc5601-1690-47c6-bf13-9ca150d31960"
    },
    "method": "manual reasoning from the cited sources' abstracts (PubMed) and Crossref metadata, checked 2026-09-11; no source opened at figure level",
    "date": "2026-09-11"
  },
  "review": {
    "state": "ai-proposed",
    "date": "2026-09-11"
  }
}
